{
  "schema_version": 1,
  "protocol": "HELIX_WORK_ENTRY_V1",
  "clean_execution_baseline": "HELIX_CLEAN_EXECUTION_BASELINE_V1",
  "work_entry_id": "011",
  "work_entry_phase": "START",
  "work_state": "ACTIVE",
  "priority": "GREEN",
  "scheduling_eligibility": "ELIGIBLE",
  "prepared_by": {
    "role": "EXECUTOR",
    "identifier": "Codex preparation session 2026-10-01"
  },
  "target_repository": {
    "name": "repo-cp",
    "canonical_remote": "https://github.com/lhpoulin-cmyk/repo-cp.git",
    "branch": "main"
  },
  "objective": "Assess whether the existing RTX 5070 Ti appliance has sufficient resources for Work Entry 009 and documented model workloads, without running a benchmark or changing capacity.",
  "governing_standards": [
    "HELIX_REPOSITORY_WORK_PROTOCOL_V1",
    "HELIX_AGENT_WORK_CONTRACT_V1 release 1.0.0",
    "gpu-cp RTX 5070 Ti accepted profiles",
    "compute-cp guest compute and training contracts"
  ],
  "authority": {
    "source": "Louis's 2026-10-01 RTX 5070 Ti execution-host resource assessment instruction",
    "granted": [
      "Read existing public resource, telemetry and benchmark evidence",
      "Register the capacity assessment as Work Entry 011 after correcting its initial local 010 assignment and prepare an assessment and measurement packet",
      "Run local synthetic repository validation"
    ],
    "explicitly_not_granted": [
      "Run a GPU workload, benchmark or stress test",
      "Install software or reallocate CPU, RAM, storage, passthrough or VM resources",
      "Purchase hardware or change live configuration",
      "Publish or merge this preparation branch"
    ],
    "live_effects_authorized": false
  },
  "canonical_baseline": {
    "intended_ref": "refs/heads/main",
    "resolved_head": "4f47ec6cc4744eaf2a158009c57553a223432cdd",
    "direct_remote_verified": false
  },
  "source_workspace": {
    "identity": "/home/louis/helix-arpa/repo-cp main checkout",
    "head": "25be360064f87d5cef52e5304da332861a9980e9",
    "dirty_state": {
      "state": "DIRTY",
      "staged": [],
      "unstaged": [
        "AGENTS.md",
        "OWNERSHIP.md",
        "PROVENANCE.md",
        "README.md"
      ],
      "untracked": [
        ".gitignore",
        "CLAUDE.md",
        "docs/AGENT_CHECKOUT_RULES.md",
        "docs/AGENT_WORK_ADOPTION.md",
        "docs/AGENT_WORK_CONTRACT.md",
        "docs/AGENT_WORK_CONTRACT_CANDIDATE.md",
        "docs/HELIX_CONTROL_PLANE.md",
        "docs/REPOSITORY_VOICE.md",
        "docs/handoffs/repo-cp-audit-remediation-20260923.md",
        "pins/agent-work-contract-candidate.json",
        "pins/agent-work-contract.json",
        "tests/test_validation_scope.py"
      ]
    },
    "dirtiness_attribution": "PRE_EXISTING"
  },
  "execution_workspace": {
    "identity": "/home/louis/helix-arpa/repo-cp/.agent-checkouts/codex/work-entry-009-gpu-pilot-prep",
    "head": "4f47ec6cc4744eaf2a158009c57553a223432cdd",
    "dirty_state": {
      "state": "CLEAN",
      "staged": [],
      "unstaged": [],
      "untracked": []
    },
    "dirtiness_attribution": "NONE",
    "mutation_gate": "OPEN"
  },
  "isolation": {
    "used": true,
    "mechanism": "CHECKOUT",
    "reason": "The primary checkout contains preserved work and the assessment must remain separate from branch-to-main cleanup."
  },
  "dependencies": [
    {
      "id": "work-entry-009.workload-definition",
      "kind": "DEPENDENCY",
      "description": "Work Entry 009 defines the only new workload whose measurements may be collected for this assessment.",
      "owner": "repo-cp",
      "blocking": false,
      "status": "ACTIVE"
    },
    {
      "id": "gpu-cp.accepted-resource-evidence",
      "kind": "CROSS_CONTROL_PLANE",
      "description": "Existing accepted model and runtime profiles provide historical measured demand.",
      "owner": "gpu-cp",
      "blocking": true,
      "status": "COMPLETED"
    },
    {
      "id": "current.live-capacity-snapshot",
      "kind": "EXTERNAL_DEPENDENCY",
      "description": "Current CPU, RAM, swap, storage and PCIe link measurements remain unobserved and are delegated to the future Work Entry 009 run packet.",
      "owner": "compute-cp and gpu-cp under Louis authorization",
      "blocking": false,
      "status": "UNKNOWN"
    }
  ],
  "expected_validation": [
    "Validate this work entry against work-entry-v1",
    "Run the focused work-protocol tests and full repo-cp validation",
    "Check JSON, Python and whitespace syntax",
    "Inspect the complete task diff"
  ],
  "mutation_scope": {
    "allowed": [
      "Add Work Entry 011 topology, capacity-assessment and measurement-packet records in the isolated repo-cp checkout",
      "Update focused topology tests"
    ],
    "prohibited": [
      "Any live benchmark, stress, host, guest, GPU, model, adapter, credential or service operation",
      "Any peer-repository mutation",
      "Any resource purchase, publication or merge"
    ]
  },
  "required_evidence": [
    "A capacity table separating GPU, CPU, RAM, storage, PCIe and software constraints",
    "Measured evidence distinguished from estimates and unknowns",
    "A scoped sufficiency conclusion and no-purchase decision unless evidence supports otherwise",
    "One coordinated measurement packet for unresolved current facts"
  ],
  "expected_result_protocol": "HELIX_WORK_RESULT_V1"
}
