{
  "schema_version": 1,
  "protocol": "HELIX_WORK_ENTRY_V1",
  "clean_execution_baseline": "HELIX_CLEAN_EXECUTION_BASELINE_V1",
  "work_entry_id": "015",
  "work_entry_phase": "CONTINUE",
  "work_state": "ACTIVE",
  "priority": "GREEN",
  "scheduling_eligibility": "ELIGIBLE",
  "prepared_by": {
    "role": "EXECUTOR",
    "identifier": "Codex Work Entry 015 format repair 2026-10-01"
  },
  "target_repository": {
    "name": "helix-offload",
    "canonical_remote": "https://github.com/lhpoulin-cmyk/helix-offload.git",
    "branch": "main"
  },
  "objective": "Repair change-summary-v1 so deterministic assembly owns known facts and the model emits only bounded summary, risk and review-note claims, then prepare but do not invoke the next local attempt.",
  "governing_standards": [
    "HELIX_REPOSITORY_WORK_PROTOCOL_V1",
    "HELIX_AGENT_WORK_CONTRACT_V1 release 1.0.0",
    "helix-offload change-summary-v1 and DERP V1 contracts",
    "Louis's 2026-10-01 offline Work Entry 015 format-repair authority"
  ],
  "authority": {
    "source": "Louis's 2026-10-01 Work Entry 015 change-summary-v1 format-repair instruction",
    "granted": [
      "Implement deterministic fact assembly and compact generated-content validation",
      "Add scoped runtime metadata preservation where the existing boundary exposes it",
      "Run offline synthetic tests and prepare a content-bound next-attempt packet without issuing its live grant",
      "Publish scoped implementation and sanitized evidence through ordinary non-forced Git workflows"
    ],
    "explicitly_not_granted": [
      "Any inference request, retry, hosted call, fallback or cohort",
      "Model download, installation, credential change or runtime-service mutation",
      "A LIVE execution grant or automatic generated-text application",
      "Activation of parked Work Entries 013 or 014"
    ],
    "live_effects_authorized": true
  },
  "canonical_baseline": {
    "intended_ref": "refs/heads/main",
    "resolved_head": "cb2cc72d799f2828188b5060d1e64c4a242f6016",
    "direct_remote_verified": true
  },
  "source_workspace": {
    "identity": "/home/louis/helix-arpa/helix-offload primary checkout",
    "head": "cb2cc72d799f2828188b5060d1e64c4a242f6016",
    "dirty_state": {"state": "CLEAN", "staged": [], "unstaged": [], "untracked": []},
    "dirtiness_attribution": "NONE"
  },
  "execution_workspace": {
    "identity": "/home/louis/helix-arpa/repo-cp/.agent-checkouts/codex/work-entry-015-format-repair-helix",
    "head": "cb2cc72d799f2828188b5060d1e64c4a242f6016",
    "dirty_state": {"state": "DIRTY", "staged": [], "unstaged": ["scoped implementation and tests"], "untracked": ["format-repair evidence and receipt-v3 schema"]},
    "dirtiness_attribution": "CURRENT_WORK_ENTRY",
    "mutation_gate": "OPEN"
  },
  "isolation": {
    "used": true,
    "mechanism": "CHECKOUT",
    "reason": "The repair and offline packet are isolated from clean primary checkouts and the unrelated local-model research branch."
  },
  "dependencies": [
    {
      "id": "015.attempt-001",
      "kind": "DEPENDENCY",
      "description": "Published refused attempt 001 provides the preserved failure evidence this repair addresses.",
      "owner": "helix-offload",
      "blocking": true,
      "status": "COMPLETED"
    }
  ],
  "expected_validation": [
    "Compact valid response assembles exact deterministic fields",
    "Unknown sources, malformed JSON, invalid types and excess content fail closed",
    "Missing usage remains UNKNOWN and exposed usage/stop metadata survives",
    "Attempt 001 files remain byte-identical",
    "Next-attempt preview is grantable but LIVE grant remains unissued and submission NOT SENT"
  ],
  "mutation_scope": {
    "allowed": ["Scoped helix-offload implementation, tests, contracts, offline evidence, review publication and ordinary canonical publication", "Work Entry 015 follow-on control records"],
    "prohibited": ["Inference, retry, hosted call, runtime mutation, unrelated research integration or generated-text application"]
  },
  "required_evidence": [
    "Attempt 001 byte-identity verification",
    "Synthetic compact response and deterministic assembled artifact",
    "Exact packet, profile, admission and preview hashes",
    "Unissued proposed grant bounds and NOT SENT status",
    "Full validation and independent publication verification"
  ],
  "expected_result_protocol": "HELIX_WORK_RESULT_V1"
}
