{
  "schema_version": 1,
  "protocol": "HELIX_WORK_ENTRY_V1",
  "clean_execution_baseline": "HELIX_CLEAN_EXECUTION_BASELINE_V1",
  "work_entry_id": "repo-cp.work-entry-standard-002",
  "work_entry_phase": "START",
  "prepared_by": {
    "role": "EXECUTOR",
    "identifier": "Codex"
  },
  "target_repository": {
    "name": "repo-cp",
    "canonical_remote": "https://github.com/lhpoulin-cmyk/repo-cp.git",
    "branch": "codex/work-entry-standard-002"
  },
  "objective": "Establish permanent work-entry, Clean Execution Baseline, upstream-first, status-topology, writer-boundary, and structured work-result standards using the smallest schema-backed repo-cp primitive.",
  "governing_standards": [
    "HELIX_AGENT_EXECUTION_DOCTRINE_V1",
    "HELIX_AGENT_WORK_CONTRACT_V1 release 1.0.0",
    "HELIX_CLEAN_EXECUTION_BASELINE_V1",
    "docs/handoffs/WORK_ENTRY_STANDARD_002.md"
  ],
  "authority": {
    "source": "Louis's direct instruction in docs/handoffs/WORK_ENTRY_STANDARD_002.md",
    "granted": [
      "Inspect, modify, and test repo-cp within the requested standard and protocol scope",
      "Use a private isolated repo-cp checkout to preserve overlapping pre-existing work"
    ],
    "explicitly_not_granted": [
      "Commit, push, merge, publish, deploy, or mutate live systems",
      "Modify peer repositories, Foundation artifacts, enrollment pins, or credentials"
    ],
    "live_effects_authorized": false
  },
  "canonical_baseline": {
    "intended_ref": "origin/main",
    "resolved_head": "f1425811f8e7fab2227367cc21b4cacdb9041d0a",
    "direct_remote_verified": true
  },
  "source_workspace": {
    "identity": "repo-cp primary checkout on main",
    "head": "25be360064f87d5cef52e5304da332861a9980e9",
    "dirty_state": {
      "state": "DIRTY",
      "staged": [],
      "unstaged": [
        "AGENTS.md",
        "OWNERSHIP.md",
        "PROVENANCE.md",
        "README.md"
      ],
      "untracked": [
        ".gitignore",
        "CLAUDE.md",
        "docs/AGENT_CHECKOUT_RULES.md",
        "docs/AGENT_WORK_ADOPTION.md",
        "docs/AGENT_WORK_CONTRACT.md",
        "docs/AGENT_WORK_CONTRACT_CANDIDATE.md",
        "docs/HELIX_CONTROL_PLANE.md",
        "docs/REPOSITORY_VOICE.md",
        "docs/handoffs/repo-cp-audit-remediation-20260923.md",
        "pins/agent-work-contract-candidate.json",
        "pins/agent-work-contract.json",
        "tests/test_validation_scope.py"
      ]
    },
    "dirtiness_attribution": "PRE_EXISTING"
  },
  "execution_workspace": {
    "identity": ".agent-checkouts/codex/work-entry-standard-002 on codex/work-entry-standard-002",
    "head": "f1425811f8e7fab2227367cc21b4cacdb9041d0a",
    "dirty_state": {
      "state": "CLEAN",
      "staged": [],
      "unstaged": [],
      "untracked": []
    },
    "dirtiness_attribution": "NONE",
    "mutation_gate": "OPEN"
  },
  "isolation": {
    "used": true,
    "mechanism": "CHECKOUT",
    "reason": "The primary checkout contained pre-existing work and was behind the directly verified canonical baseline."
  },
  "dependencies": [
    {
      "id": "dependency.work-contract",
      "kind": "DEPENDENCY",
      "description": "The pinned Helix Agent Work Contract must match its required digest.",
      "owner": "repo-cp",
      "status": "COMPLETED"
    },
    {
      "id": "dependency.canonical-base",
      "kind": "DEPENDENCY",
      "description": "Implementation must use the current canonical repo-cp source without overwriting the dirty original checkout.",
      "owner": "repo-cp",
      "status": "COMPLETED"
    },
    {
      "id": "dependency.peer-audits",
      "kind": "EXTERNAL_DEPENDENCY",
      "description": "Fleet audit findings remain owned by enrolled peer repositories and repo-cp enrollment review.",
      "owner": "auth-cp and ansible-cp owners",
      "status": "DRIFT"
    }
  ],
  "expected_validation": [
    "Validate both JSON schemas and valid and invalid protocol fixtures",
    "Run the full repo-cp and Foundation synthetic suite",
    "Run the local file-integrity audit and enrolled fleet audit",
    "Run Git whitespace and complete-diff checks"
  ],
  "mutation_scope": {
    "allowed": [
      "repo-cp work protocol documentation, schemas, bounded validator, CLI wiring, fixtures, tests, and task evidence"
    ],
    "prohibited": [
      "Foundation vendor bytes, repository enrollment state, peer repositories, remote refs, credentials, and live systems"
    ]
  },
  "required_evidence": [
    "Verbatim handoff file",
    "Dirty source and clean execution workspace evidence",
    "Schema-valid task work entry and result",
    "Full validation results",
    "Git state, canonical parity, pre-existing dirtiness, comparison, and usage record"
  ],
  "expected_result_protocol": "HELIX_WORK_RESULT_V1"
}
