{
  "schema_version": 1,
  "protocol": "HELIX_WORK_ENTRY_V1",
  "clean_execution_baseline": "HELIX_CLEAN_EXECUTION_BASELINE_V1",
  "work_entry_id": "009",
  "work_entry_phase": "START",
  "work_state": "ACTIVE",
  "priority": "GREEN",
  "scheduling_eligibility": "ELIGIBLE",
  "prepared_by": {
    "role": "EXECUTOR",
    "identifier": "Codex preparation session 2026-10-01"
  },
  "target_repository": {
    "name": "repo-cp",
    "canonical_remote": "https://github.com/lhpoulin-cmyk/repo-cp.git",
    "branch": "main"
  },
  "objective": "Prepare a concrete, bounded and separately authorized RTX 5070 Ti execution pilot without running it.",
  "governing_standards": [
    "HELIX_REPOSITORY_WORK_PROTOCOL_V1",
    "HELIX_AGENT_WORK_CONTRACT_V1 release 1.0.0",
    "gpu-cp RTX 5070 Ti runtime policy",
    "gpu-compute guest runtime boundary"
  ],
  "authority": {
    "source": "Louis's 2026-10-01 first bounded RTX 5070 Ti execution pilot preparation instruction",
    "granted": [
      "Read public repository evidence and existing bounded adapter contracts",
      "Register Work Entry 009 and prepare a reviewable execution packet",
      "Run local synthetic repository validation"
    ],
    "explicitly_not_granted": [
      "Invoke a model or GPU workload",
      "Install or deploy software",
      "Change credentials, accounts, services, VM allocation, passthrough or live configuration",
      "Publish or merge this preparation branch"
    ],
    "live_effects_authorized": false
  },
  "canonical_baseline": {
    "intended_ref": "refs/heads/main",
    "resolved_head": "4f47ec6cc4744eaf2a158009c57553a223432cdd",
    "direct_remote_verified": false
  },
  "source_workspace": {
    "identity": "/home/louis/helix-arpa/repo-cp main checkout",
    "head": "25be360064f87d5cef52e5304da332861a9980e9",
    "dirty_state": {
      "state": "DIRTY",
      "staged": [],
      "unstaged": [
        "AGENTS.md",
        "OWNERSHIP.md",
        "PROVENANCE.md",
        "README.md"
      ],
      "untracked": [
        ".gitignore",
        "CLAUDE.md",
        "docs/AGENT_CHECKOUT_RULES.md",
        "docs/AGENT_WORK_ADOPTION.md",
        "docs/AGENT_WORK_CONTRACT.md",
        "docs/AGENT_WORK_CONTRACT_CANDIDATE.md",
        "docs/HELIX_CONTROL_PLANE.md",
        "docs/REPOSITORY_VOICE.md",
        "docs/handoffs/repo-cp-audit-remediation-20260923.md",
        "pins/agent-work-contract-candidate.json",
        "pins/agent-work-contract.json",
        "tests/test_validation_scope.py"
      ]
    },
    "dirtiness_attribution": "PRE_EXISTING"
  },
  "execution_workspace": {
    "identity": "/home/louis/helix-arpa/repo-cp/.agent-checkouts/codex/work-entry-009-gpu-pilot-prep",
    "head": "4f47ec6cc4744eaf2a158009c57553a223432cdd",
    "dirty_state": {
      "state": "CLEAN",
      "staged": [],
      "unstaged": [],
      "untracked": []
    },
    "dirtiness_attribution": "NONE",
    "mutation_gate": "OPEN"
  },
  "isolation": {
    "used": true,
    "mechanism": "CHECKOUT",
    "reason": "The primary checkout contains preserved work from separate sessions and must not be used for this entry."
  },
  "dependencies": [
    {
      "id": "gpu-compute.cuda-smoke-source",
      "kind": "CROSS_CONTROL_PLANE",
      "description": "Reviewed bounded CUDA smoke implementation at gpu-compute c1d001a8f19ff4108d303f4529dde276e39f8253.",
      "owner": "gpu-compute",
      "blocking": true,
      "status": "COMPLETED"
    },
    {
      "id": "gpu-cp.runtime-policy",
      "kind": "CROSS_CONTROL_PLANE",
      "description": "Accepted RTX 5070 Ti identity and compute-validation boundary at gpu-cp e64e39c029616d69ec4523500facd20e7a75c9f2.",
      "owner": "gpu-cp",
      "blocking": true,
      "status": "COMPLETED"
    },
    {
      "id": "operator.live-run-authorization",
      "kind": "EXTERNAL_DEPENDENCY",
      "description": "A later exact authorization must name the guest session, command packet, executor and evidence destination.",
      "owner": "Louis",
      "blocking": false,
      "status": "AUTHORIZATION_REQUIRED"
    }
  ],
  "expected_validation": [
    "Validate this work entry against work-entry-v1",
    "Run the focused work-protocol tests and full repo-cp validation",
    "Check JSON, Python and whitespace syntax",
    "Inspect the complete task diff"
  ],
  "mutation_scope": {
    "allowed": [
      "Add Work Entry 009 topology, evidence and pilot-packet records in the isolated repo-cp checkout",
      "Update focused topology tests"
    ],
    "prohibited": [
      "Any live host, guest, GPU, model, adapter, credential or service operation",
      "Any peer-repository mutation",
      "Any publication or merge"
    ]
  },
  "required_evidence": [
    "Exact repository source revisions and authority owners",
    "A fixed-input, bounded-command pilot with timeout and cleanup",
    "Explicit admission, execution and evidence-return boundaries",
    "Remaining unknowns and exact authorization required"
  ],
  "expected_result_protocol": "HELIX_WORK_RESULT_V1"
}
