{
  "schema_version": 1,
  "protocol": "HELIX_WORK_ENTRY_V1",
  "clean_execution_baseline": "HELIX_CLEAN_EXECUTION_BASELINE_V1",
  "work_entry_id": "012",
  "work_entry_phase": "START",
  "work_state": "PARKED",
  "priority": "GREEN",
  "scheduling_eligibility": "INELIGIBLE_STATE",
  "prepared_by": {
    "role": "EXECUTOR",
    "identifier": "Codex efficiency-priority reconciliation 2026-10-01"
  },
  "target_repository": {
    "name": "repo-cp",
    "canonical_remote": "https://github.com/lhpoulin-cmyk/repo-cp.git",
    "branch": "main"
  },
  "objective": "Discover and reconcile GitHub-hosted repository or account identity with local Git authentication and identity surfaces without reading credentials or changing accounts, credentials or configuration.",
  "governing_standards": [
    "HELIX_REPOSITORY_WORK_PROTOCOL_V1",
    "HELIX_AGENT_WORK_CONTRACT_V1 release 1.0.0",
    "Louis's 2026-10-01 efficiency-priority reconciliation instruction"
  ],
  "authority": {
    "source": "Louis's 2026-10-01 efficiency-priority reconciliation instruction",
    "granted": [
      "Locate an existing public GitHub/local-auth task record using safe read-only repository evidence",
      "Register the previously requested discovery scope at the next verified free work-entry number when absent",
      "Run local synthetic repository validation and publish the registration through the authorized repo-cp workflow"
    ],
    "explicitly_not_granted": [
      "Read credential stores, tokens, secret-bearing environment values or private payloads",
      "Change an account, credential, authentication session, Git identity, remote, workstation or service",
      "Implement or publish changes in auth-cp, ws-cp, GitHub or another peer repository",
      "Treat synthetic Work Entry 007 identity evidence as live authentication proof"
    ],
    "live_effects_authorized": false
  },
  "canonical_baseline": {
    "intended_ref": "refs/heads/main",
    "resolved_head": "37a84624c029fba101f9899affab714e4b31b49f",
    "direct_remote_verified": true
  },
  "source_workspace": {
    "identity": "/home/louis/helix-arpa/repo-cp main checkout",
    "head": "25be360064f87d5cef52e5304da332861a9980e9",
    "dirty_state": {
      "state": "DIRTY",
      "staged": [],
      "unstaged": [
        "AGENTS.md",
        "OWNERSHIP.md",
        "PROVENANCE.md",
        "README.md"
      ],
      "untracked": [
        ".aws",
        ".gitignore",
        "CLAUDE.md",
        "docs/AGENT_CHECKOUT_RULES.md",
        "docs/AGENT_WORK_ADOPTION.md",
        "docs/AGENT_WORK_CONTRACT.md",
        "docs/AGENT_WORK_CONTRACT_CANDIDATE.md",
        "docs/HELIX_CONTROL_PLANE.md",
        "docs/REPOSITORY_VOICE.md",
        "docs/handoffs/repo-cp-audit-remediation-20260923.md",
        "pins/agent-work-contract-candidate.json",
        "pins/agent-work-contract.json",
        "tests/test_validation_scope.py"
      ]
    },
    "dirtiness_attribution": "PRE_EXISTING"
  },
  "execution_workspace": {
    "identity": "/home/louis/helix-arpa/repo-cp/.agent-checkouts/codex/efficiency-priority-reconciliation",
    "head": "37a84624c029fba101f9899affab714e4b31b49f",
    "dirty_state": {
      "state": "CLEAN",
      "staged": [],
      "unstaged": [],
      "untracked": []
    },
    "dirtiness_attribution": "NONE",
    "mutation_gate": "CLOSED"
  },
  "isolation": {
    "used": true,
    "mechanism": "CHECKOUT",
    "reason": "The task is parked after isolated recovery registration; its discovery pass is not active and its mutation gate is closed."
  },
  "dependencies": [
    {
      "id": "work-entry-007.synthetic-identity-evidence",
      "kind": "DEPENDENCY",
      "description": "Completed Work Entry 007 supplies bounded synthetic Git identity-profile comparison and commit-executor attribution but no live authentication proof.",
      "owner": "repo-cp",
      "blocking": false,
      "status": "COMPLETED"
    },
    {
      "id": "github-local-auth.resume-authority",
      "kind": "EXTERNAL_DEPENDENCY",
      "description": "A later resume must retain the read-only non-secret boundary and separately authorize any material expansion.",
      "owner": "Louis",
      "blocking": false,
      "status": "AUTHORIZATION_REQUIRED"
    }
  ],
  "expected_validation": [
    "Validate this registration against work-entry-v1",
    "Verify canonical numbering and direct remote branch inventory",
    "Run focused work-protocol tests and full repo-cp validation",
    "Inspect the complete registration diff"
  ],
  "mutation_scope": {
    "allowed": [
      "Register Work Entry 012 and its read-only discovery boundary in repo-cp",
      "Correct maintained current-state and efficiency-order records"
    ],
    "prohibited": [
      "Credential-store, account, authentication-session, Git identity, remote, workstation or service mutation",
      "Peer-repository mutation or live authentication testing"
    ]
  },
  "required_evidence": [
    "Fresh canonical repo-cp registry and remote branch identities",
    "Relevant Work Entry 007 boundary",
    "Explicit owner and secret-handling boundaries",
    "Exact next safe discovery action"
  ],
  "expected_result_protocol": "HELIX_WORK_RESULT_V1"
}
