{
  "schema_version": 1,
  "protocol": "HELIX_WORK_ENTRY_V1",
  "clean_execution_baseline": "HELIX_CLEAN_EXECUTION_BASELINE_V1",
  "work_entry_id": "010",
  "work_entry_phase": "CONTINUE",
  "work_state": "ACTIVE",
  "priority": "GREEN",
  "scheduling_eligibility": "ELIGIBLE",
  "prepared_by": {
    "role": "EXECUTOR",
    "identifier": "Codex DERP recovery session 2026-10-01"
  },
  "target_repository": {
    "name": "repo-cp",
    "canonical_remote": "https://github.com/lhpoulin-cmyk/repo-cp.git",
    "branch": "main"
  },
  "objective": "Recover and register Work Entry 010 as DERP, Deterministic Engine for Policy and Routing, without inventing missing implementation progress, ownership or dependencies.",
  "governing_standards": [
    "HELIX_REPOSITORY_WORK_PROTOCOL_V1",
    "HELIX_AGENT_WORK_CONTRACT_V1 release 1.0.0",
    "Louis's 2026-10-01 DERP numbering correction"
  ],
  "authority": {
    "source": "Louis's 2026-10-01 follow-up during active repo-cp cleanup",
    "granted": [
      "Reserve Work Entry 010 for DERP",
      "Search registry, branches, worktrees, handoffs and relevant history for preserved DERP evidence",
      "Create a clearly labeled recovery record when preserved DERP records are absent",
      "Run local synthetic repository validation"
    ],
    "explicitly_not_granted": [
      "Invent or implement DERP behavior",
      "Assign DERP ownership or dependencies without evidence",
      "Run a workload, deploy, install or change live configuration",
      "Publish or merge this recovery branch"
    ],
    "live_effects_authorized": false
  },
  "canonical_baseline": {
    "intended_ref": "refs/heads/codex/work-entry-009-gpu-pilot-prep",
    "resolved_head": "1df7226210012096dde02b84593b4c29351ee14f",
    "direct_remote_verified": false
  },
  "source_workspace": {
    "identity": "/home/louis/helix-arpa/repo-cp/.agent-checkouts/codex/reconcile-preserved-work",
    "head": "d46ac50128ea3491886476b81c5b75b7d6b0bd76",
    "dirty_state": {
      "state": "CLEAN",
      "staged": [],
      "unstaged": [],
      "untracked": []
    },
    "dirtiness_attribution": "NONE"
  },
  "execution_workspace": {
    "identity": "/home/louis/helix-arpa/repo-cp/.agent-checkouts/codex/work-entry-009-gpu-pilot-prep",
    "head": "1df7226210012096dde02b84593b4c29351ee14f",
    "dirty_state": {
      "state": "CLEAN",
      "staged": [],
      "unstaged": [],
      "untracked": []
    },
    "dirtiness_attribution": "NONE",
    "mutation_gate": "OPEN"
  },
  "isolation": {
    "used": true,
    "mechanism": "CHECKOUT",
    "reason": "The numbering correction must remain isolated from canonical cleanup and preserved primary-checkout work."
  },
  "dependencies": [
    {
      "id": "derp.preserved-evidence",
      "kind": "DEPENDENCY",
      "description": "Earlier DERP handoff, implementation content and validation evidence were not found in the inspected repository surfaces.",
      "owner": "UNKNOWN pending operator-held evidence",
      "blocking": false,
      "status": "UNKNOWN"
    },
    {
      "id": "derp.ownership-and-dependencies",
      "kind": "EXTERNAL_DEPENDENCY",
      "description": "The owning repository or control plane and DERP's actual dependencies are not evidenced by the recovered material.",
      "owner": "UNKNOWN",
      "blocking": false,
      "status": "UNKNOWN"
    },
    {
      "id": "derp.implementation-authority",
      "kind": "EXTERNAL_DEPENDENCY",
      "description": "Recovery registration does not authorize DERP implementation.",
      "owner": "Louis",
      "blocking": false,
      "status": "AUTHORIZATION_REQUIRED"
    }
  ],
  "expected_validation": [
    "Validate this recovery entry against work-entry-v1",
    "Run focused work-protocol tests and full repo-cp validation",
    "Verify fresh canonical registry identity and absence of an 011 collision",
    "Inspect the complete renumbering diff"
  ],
  "mutation_scope": {
    "allowed": [
      "Register DERP as Work Entry 010 using operator-supplied identity and explicit UNKNOWN fields",
      "Renumber the capacity assessment to Work Entry 011 and preserve the historical mapping",
      "Update focused topology tests and maintained references"
    ],
    "prohibited": [
      "DERP implementation or inferred architecture, ownership, dependencies or progress",
      "Any live host, guest, GPU, model, credential, account, service or peer mutation",
      "Any publication or merge"
    ]
  },
  "required_evidence": [
    "Fresh canonical main revision and registry contents",
    "DERP search coverage and explicit absence result",
    "Operator-supplied DERP identity and BLUE health provenance",
    "Immutable old-to-new capacity-assessment mapping"
  ],
  "expected_result_protocol": "HELIX_WORK_RESULT_V1"
}
